{
  "license": "https://www.apache.org/licenses/LICENSE-2.0",
  "$schema": "https://json-schema.org/draft/2020-12/schema",
  "$id": "https://w3id.org/battinfo/schema/housing-spec.schema.json",
  "title": "BattINFO Housing Spec",
  "description": "Reusable housing specification. The 'spec' half of the housing-spec + housing pair.",
  "type": "object",
  "additionalProperties": false,
  "required": [
    "schema_version",
    "housing_spec",
    "provenance"
  ],
  "properties": {
    "schema_version": {
      "type": "string",
      "pattern": "^\\d+\\.\\d+\\.\\d+(-[A-Za-z0-9.-]+)?$",
      "description": "Version of the record schema this document conforms to (semantic versioning); stamped by the library on save."
    },
    "housing_spec": {
      "type": "object",
      "additionalProperties": false,
      "required": [
        "id",
        "name"
      ],
      "properties": {
        "id": {
          "$ref": "#/$defs/ComponentSpecIri"
        },
        "short_id": {
          "$ref": "#/$defs/ShortId"
        },
        "name": {
          "type": "string",
          "minLength": 1,
          "description": "Human-readable name of this housing design (e.g. 'CR2032 SS316L case')."
        },
        "handle": {
          "$ref": "#/$defs/Handle",
          "description": "Short readable slug, unique within one registry workspace (e.g. 'flores-ocv/graphite-aq-1-063b77-cell'). Display text, never part of the identity."
        },
        "cell_format": {
          "type": "string",
          "enum": [
            "coin",
            "cylindrical",
            "pouch",
            "prismatic",
            "other",
            "unknown"
          ],
          "description": "Cell format this housing is for."
        },
        "case": {
          "$ref": "modules/components/housing.schema.json#/$defs/Case",
          "description": "Main case or can of the housing."
        },
        "cap": {
          "$ref": "modules/components/housing.schema.json#/$defs/HardwarePart",
          "description": "Cap or lid part."
        },
        "terminals": {
          "type": "array",
          "items": {
            "$ref": "modules/components/housing.schema.json#/$defs/Terminal"
          },
          "description": "Electrical terminals, with polarity and material."
        },
        "seals": {
          "type": "array",
          "items": {
            "$ref": "modules/components/housing.schema.json#/$defs/Seal"
          },
          "description": "Seals and gaskets."
        },
        "parts": {
          "type": "array",
          "items": {
            "$ref": "modules/components/housing.schema.json#/$defs/HardwarePart"
          },
          "description": "Other hardware parts (springs, spacers, ...)."
        },
        "property": {
          "$ref": "modules/common/quantitative-properties.schema.json",
          "description": "Named quantity map of housing-level properties (e.g. mass, wall_thickness). See the property keys reference for the full list of recognised keys."
        },
        "manufacturer": {
          "$ref": "#/$defs/OrgRef",
          "description": "Manufacturer of the item."
        },
        "supplier": {
          "$ref": "#/$defs/OrgRef",
          "description": "Supplier or vendor the item was sourced from."
        },
        "product_id": {
          "type": "string",
          "description": "Manufacturer or supplier product/grade identifier."
        },
        "comment": {
          "type": "string",
          "description": "Free-text comment."
        }
      },
      "description": "The housing design being specified."
    },
    "provenance": {
      "$ref": "#/$defs/Provenance",
      "description": "Where the information in this record came from: source type, file or URL, citation, and retrieval time."
    },
    "notes": {
      "type": "array",
      "items": {
        "type": "string"
      },
      "description": "Free-text notes carried with the record."
    }
  },
  "$defs": {
    "ComponentSpecIri": {
      "type": "string",
      "pattern": "^https://w3id\\.org/battinfo/(?:spec|material-spec|electrode-spec|separator-spec|electrolyte-spec|current-collector-spec|housing-spec)/[0-9a-hjkmnp-tv-z]{4}(?:-[0-9a-hjkmnp-tv-z]{4}){3}$"
    },
    "ShortId": {
      "type": "string",
      "pattern": "^[0-9a-hjkmnp-tv-z]{6,16}$",
      "description": "Short human-friendly identifier derived from the record IRI (Crockford base32, 6-16 characters)."
    },
    "Handle": {
      "type": "string",
      "pattern": "^[a-z0-9]+(?:-[a-z0-9]+)*(?:/[a-z0-9]+(?:-[a-z0-9]+)*)*$",
      "maxLength": 120,
      "description": "Short readable slug for this record, unique within one registry workspace and shown as <workspace>/<handle> (e.g. 'flores-ocv/graphite-aq-1-063b77-cell'). Lowercase ASCII segments joined by '/', each made of letters and digits separated by single hyphens; at most 120 characters. Display text only: the record's identity is its IRI, and a handle may be corrected without moving it. Build one with battinfo.naming.handle_for()."
    },
    "UnixTime": {
      "type": "integer",
      "minimum": 0,
      "description": "Unix timestamp in whole seconds since 1970-01-01T00:00:00Z."
    },
    "OrganizationIri": {
      "type": "string",
      "pattern": "^https://w3id\\.org/battinfo/organization/[0-9a-hjkmnp-tv-z]{4}(?:-[0-9a-hjkmnp-tv-z]{4}){3}$",
      "description": "Canonical BattINFO IRI in the organization/ namespace (https://w3id.org/battinfo/organization/xxxx-xxxx-xxxx-xxxx)."
    },
    "Organization": {
      "type": "object",
      "additionalProperties": false,
      "required": [
        "name"
      ],
      "properties": {
        "type": {
          "const": "Organization",
          "description": "JSON-LD type discriminator."
        },
        "id": {
          "$ref": "#/$defs/OrganizationIri",
          "description": "Canonical BattINFO organization IRI linking this party to its organization record."
        },
        "name": {
          "type": "string",
          "minLength": 1,
          "description": "Organization name."
        },
        "url": {
          "type": "string",
          "format": "uri",
          "description": "Homepage URL."
        }
      },
      "description": "An organization referenced by name, with an optional canonical BattINFO organization IRI."
    },
    "OrgRef": {
      "oneOf": [
        {
          "type": "string",
          "minLength": 1
        },
        {
          "$ref": "#/$defs/Organization"
        }
      ],
      "description": "An organization, as either a plain name string or a structured Organization object that can carry a canonical organization IRI."
    },
    "Provenance": {
      "type": "object",
      "additionalProperties": false,
      "required": [
        "source_type"
      ],
      "properties": {
        "source_type": {
          "type": "string",
          "enum": [
            "datasheet",
            "manufacturer",
            "measurement",
            "lab",
            "literature",
            "manual",
            "other"
          ],
          "description": "Kind of source this record was created from."
        },
        "source_name": {
          "type": "string",
          "description": "Human-readable name of the source (document title, instrument, lab, or system)."
        },
        "source_file": {
          "type": "string",
          "description": "Filename or path of the source file, when the record was derived from a file."
        },
        "source_url": {
          "oneOf": [
            {
              "type": "string",
              "format": "uri"
            },
            {
              "type": "null"
            }
          ],
          "description": "URL of the source document or landing page, when available."
        },
        "citation": {
          "type": "string",
          "format": "uri",
          "description": "Resolvable citation target to use for attribution, typically a DOI URL."
        },
        "citation_doi": {
          "type": "string",
          "pattern": "^10\\.\\d{4,9}/[-._;()/:A-Za-z0-9]+$",
          "description": "DOI of the source publication (bare '10.xxxx/...' form). Prefer provenance.citation with a DOI resolver URL."
        },
        "retrieved_at": {
          "$ref": "#/$defs/UnixTime",
          "description": "Unix timestamp (seconds since epoch, UTC) when the source was retrieved or the record was captured."
        },
        "battinfo_version": {
          "type": "string",
          "pattern": "^\\d+\\.\\d+\\.\\d+(-[A-Za-z0-9.-]+)?$",
          "description": "Version of the battinfo library that wrote this record (semantic versioning); stamped on save."
        }
      }
    },
    "Case": {
      "type": "object",
      "additionalProperties": false,
      "properties": {
        "size_code": {
          "type": "string"
        },
        "coating": {
          "type": "string"
        },
        "material": {
          "type": "string"
        },
        "manufacturer": {
          "$ref": "#/$defs/OrgRef"
        },
        "supplier": {
          "$ref": "#/$defs/OrgRef"
        },
        "product_id": {
          "type": "string"
        },
        "property": {
          "$ref": "modules/common/quantitative-properties.schema.json"
        },
        "comment": {
          "type": "string"
        }
      }
    },
    "Terminal": {
      "type": "object",
      "additionalProperties": false,
      "properties": {
        "polarity": {
          "type": "string",
          "enum": [
            "positive",
            "negative"
          ]
        },
        "material": {
          "type": "string"
        },
        "manufacturer": {
          "$ref": "#/$defs/OrgRef"
        },
        "supplier": {
          "$ref": "#/$defs/OrgRef"
        },
        "product_id": {
          "type": "string"
        },
        "property": {
          "$ref": "modules/common/quantitative-properties.schema.json"
        },
        "comment": {
          "type": "string"
        }
      }
    },
    "Seal": {
      "type": "object",
      "additionalProperties": false,
      "properties": {
        "material": {
          "type": "string"
        },
        "manufacturer": {
          "$ref": "#/$defs/OrgRef"
        },
        "supplier": {
          "$ref": "#/$defs/OrgRef"
        },
        "product_id": {
          "type": "string"
        },
        "property": {
          "$ref": "modules/common/quantitative-properties.schema.json"
        },
        "comment": {
          "type": "string"
        }
      }
    },
    "HardwarePart": {
      "type": "object",
      "additionalProperties": false,
      "properties": {
        "type": {
          "type": "string",
          "enum": [
            "cap",
            "lid",
            "can",
            "spring",
            "spacer",
            "vent",
            "other"
          ]
        },
        "coating": {
          "type": "string"
        },
        "material": {
          "type": "string"
        },
        "manufacturer": {
          "$ref": "#/$defs/OrgRef"
        },
        "supplier": {
          "$ref": "#/$defs/OrgRef"
        },
        "product_id": {
          "type": "string"
        },
        "property": {
          "$ref": "modules/common/quantitative-properties.schema.json"
        },
        "comment": {
          "type": "string"
        }
      },
      "description": "Where the information in this record came from: source type, file or URL, citation, and retrieval time."
    }
  }
}
